{"channels_scored":["bed1","bed2","bfo1","bfo2","bso1","bso2","bso3","ced1","cfo1","cso1"],"methods":{"pca":{"all":{"hit_at_1":0.7,"hit_at_3":0.915,"hit_at_3_any":0.925,"mean_root_rank":1.67,"n":200},"test":{"hit_at_1":0.6417910447761194,"hit_at_3":0.8955223880597015,"hit_at_3_any":0.9104477611940298,"mean_root_rank":1.791044776119403,"n":67}},"robust_z":{"all":{"hit_at_1":0.485,"hit_at_3":0.825,"hit_at_3_any":0.825,"mean_root_rank":2.38,"n":200},"test":{"hit_at_1":0.417910447761194,"hit_at_3":0.7910447761194029,"hit_at_3_any":0.7910447761194029,"mean_root_rank":2.5074626865671643,"n":67}}},"per_root_cause":{"bed1":{"hit_at_1_pca":0.8846153846153846,"hit_at_1_robust_z":0.38461538461538464,"n":26},"bed2":{"hit_at_1_pca":0.05555555555555555,"hit_at_1_robust_z":0.3055555555555556,"n":36},"bfo1":{"hit_at_1_pca":0.6666666666666666,"hit_at_1_robust_z":0.5,"n":24},"bfo2":{"hit_at_1_pca":1.0,"hit_at_1_robust_z":0.6363636363636364,"n":33},"bso1":{"hit_at_1_pca":0.9583333333333334,"hit_at_1_robust_z":1.0,"n":24},"bso2":{"hit_at_1_pca":0.8125,"hit_at_1_robust_z":0.15625,"n":32},"bso3":{"hit_at_1_pca":0.68,"hit_at_1_robust_z":0.56,"n":25}},"random_baseline":{"hit_at_1":0.1,"hit_at_3":0.3,"hit_at_3_any":0.5333333333333333,"mean_root_rank":5.5},"schema_version":"v1","tags":{"attribution":"DERIVED","labels":"SYNTHETIC"},"wording":"Contributing measurements, not causes. The dataset's own column is named root_cause; we score the top-ranked channels against it as a benchmark label only."}
